{"schemaVersion":2,"workPackageId":"WP-EMP-EGRESS-INPUT-QUALIFY-02","gateId":"GATE-049","runId":"employee-egress-input-qualification-v2-20260814-candidate-02","manifestSha256":"6d853ecee412a734f111d1d30740a703fe0343593560b7b01ed4c5194dfdb66f","authorizationReference":"P3_00:GATE-049","recordedAt":"2026-08-14T04:16:01.147704800Z","status":"not_qualified","selectionMode":"read_only_database","egressReason":"employee.no_qualified_input","codecMinimumFieldPresence":{"idCardNo":false,"chineseName":false,"position":false,"workBaseSi":false},"requiredUserResultFieldPresence":{"employeeIdMasked":false,"chineseName":false},"counts":{"databaseSelectionStarted":1,"databaseSelectionTerminal":1,"databaseSelectionRows":0,"employeeDetailStarted":0,"employeeDetailTerminal":0,"otherEmployeeEndpoints":0,"modelCalls":0,"retryCount":0,"resumeCount":0},"failure":{"phase":"database_selection","reason":"employee.no_qualified_input"},"lifecycle":{"recordCount":4,"sha256":"570295951f8bf1a109156c017c30609ca548bfba3f021bff4cd2825f978ac231"},"safety":{"identifierPersisted":false,"jwtPersisted":false,"fieldValuesPersisted":false,"rawResponsePersisted":false,"llmApiKeyRead":false,"modelOutbound":false,"logLeakCount":0,"logScanCompleted":true,"rawLogsDeleted":true}}
